{
  "schemaVersion" : "matching.m13.inherited-architecture.v1",
  "status" : "PASS",
  "replacementFor" : "M10_CORE_DELTA_AND_M11_M12_CORE_UNCHANGED_ONLY",
  "matchingCoreByteIdentical" : false,
  "currentCoreSourceDigest" : "852db6c9f175da96847be82a544aab5ea6d5200d9a77fbc38a2555af191ba5fa",
  "baselineCoreTree" : "58ce86179251a5a8cceba47ff41b1b2657a5d100",
  "inspectedCoreSources" : 55,
  "coreInfrastructureFree" : true,
  "m11WireSourcesByteIdentical" : true,
  "m11WireSourceGitBlobs" : {
    "matching-cluster-runtime/src/main/java/io/github/lchareln/cex/matching/cluster/M11CommandRequest.java" : "5c765f680b008e516f783f9062654e34f6b0b28e",
    "matching-cluster-runtime/src/main/java/io/github/lchareln/cex/matching/cluster/M11CommandResponse.java" : "9cb6ad621025124a3d4828f983640b8a9147f849",
    "matching-cluster-runtime/src/main/java/io/github/lchareln/cex/matching/cluster/M11RequestCodec.java" : "4f3160e2fc331fe1b6678b7b24d2542e6f86ba99",
    "matching-cluster-runtime/src/main/java/io/github/lchareln/cex/matching/cluster/M11ResponseCodec.java" : "7deeb0a96404d5fce79a9c8452c6eba028b8bc8b",
    "matching-cluster-runtime/src/main/java/io/github/lchareln/cex/matching/cluster/M11Snapshot.java" : "de652550140d2f70d025b710c70eaa71a823ad56",
    "matching-cluster-runtime/src/main/java/io/github/lchareln/cex/matching/cluster/M11SnapshotCodec.java" : "84d7ef80d3c04391feb4328420c28fac106074ec"
  },
  "m11ProtocolGoldens" : 6,
  "m11LogCallbackBusinessApplyCalls" : 1,
  "m11NonLogCallbackBusinessApplyCalls" : 0,
  "m11RuntimeMetadataDigestStable" : true,
  "m10CurrentAlgorithmInfrastructureAndBenchmarkBoundariesPassed" : true,
  "m10TestkitProbeOccurrences" : 1,
  "m10InspectedLocalRuntimeSources" : 54,
  "m10InspectedBenchmarkSources" : 30,
  "m10ObservedHistoricalCoreDeltaPaths" : [ "matching-core/src/main/java/io/github/lchareln/cex/matching/CancelOrder.java", "matching-core/src/main/java/io/github/lchareln/cex/matching/CancelOrderValidator.java", "matching-core/src/main/java/io/github/lchareln/cex/matching/MarketControlSnapshot.java", "matching-core/src/main/java/io/github/lchareln/cex/matching/MarketRuleSetArtifact.java", "matching-core/src/main/java/io/github/lchareln/cex/matching/PlaceLimitOrder.java", "matching-core/src/main/java/io/github/lchareln/cex/matching/PlaceLimitOrderValidator.java", "matching-core/src/main/java/io/github/lchareln/cex/matching/PrepareRuleSetRejectionCode.java", "matching-core/src/main/java/io/github/lchareln/cex/matching/SingleInstrumentMatchingEngine.java", "matching-core/src/test/java/io/github/lchareln/cex/matching/CancelOrderValidatorTest.java", "matching-core/src/test/java/io/github/lchareln/cex/matching/ConfiguredInstrumentMatchingEngineTest.java", "matching-core/src/test/java/io/github/lchareln/cex/matching/SingleInstrumentTerminalHistoryGrowthTest.java" ],
  "m11CurrentProductionBoundary" : {
    "schemaVersion" : "matching.m13.inherited-m11-boundary.v1",
    "status" : "PASS",
    "m10CoreTree" : "58ce86179251a5a8cceba47ff41b1b2657a5d100",
    "headCoreTree" : "eec06b3567796727ada84191af72490a575c728a",
    "matchingCoreByteIdentical" : false,
    "coreIdentityEvidenceMode" : "CURRENT_WORKTREE_M13_WITNESS",
    "currentCoreSourceDigest" : "852db6c9f175da96847be82a544aab5ea6d5200d9a77fbc38a2555af191ba5fa",
    "qualificationFaultSelectionsOutsideTestkit" : 0,
    "normalFaultPolicy" : "NONE",
    "coreInfrastructureFree" : true,
    "aeronProductionModule" : "matching-cluster-runtime",
    "aeronJavaImportFiles" : 14,
    "aeronJavaImportViolations" : 0,
    "aeronDependencyViolations" : 0,
    "clusterServiceLocalWalViolations" : 0,
    "clusterServiceExternalIoViolations" : 0,
    "callbackReachableStandaloneWalReferences" : 0,
    "callbackReachableExternalIoReferences" : 0,
    "standaloneWalWrites" : 0,
    "standaloneWalWritesEvidenceMode" : "CALLBACK_REACHABLE_SOURCE_REFERENCE_COUNT_COMPATIBILITY",
    "runtimeMetadataInBusinessDigest" : false,
    "callbackInterface" : "io.aeron.cluster.service.ClusteredService",
    "abstractProductionCallbacks" : 8,
    "implementedProductionCallbacks" : 8,
    "callbackReachableClasses" : 27,
    "callbackModuleViolations" : 0,
    "businessApplyCalls" : 1,
    "logCallbackBusinessApplyCalls" : 1,
    "nonLogCallbackBusinessApplyCalls" : 0,
    "egressStateInputViolations" : 0,
    "configuredAeronVersion" : "1.52.2",
    "configuredAgronaVersion" : "2.5.0",
    "versionConfigurationExact" : true,
    "runtimeMetadataSpyExecuted" : true,
    "runtimeMetadataVariants" : 2,
    "runtimeMetadataDigestStable" : true,
    "callbackReachableProductionSources" : [ "DirectM11MatchingRuntime", "M11AeronSnapshotTransport", "M11ApplicationObserver", "M11ApplicationResult", "M11ApplicationSnapshotWitness", "M11Binary", "M11BoundedProgress", "M11ClusteredMatchingService", "M11CommandRequest", "M11CommandResponse", "M11CommandStateCodec", "M11Digests", "M11EncodingBounds", "M11FaultPolicy", "M11FullResultCodec", "M11IdentityBinding", "M11IdentityTable", "M11ProtocolException", "M11RequestCodec", "M11ResponseCodec", "M11ResponseStatus", "M11RuntimeState", "M11RuntimeStateCodec", "M11ServiceObservation", "M11Snapshot", "M11SnapshotCodec", "M11SnapshotFrameCodec" ],
    "violations" : [ ]
  }
}
